{
  "task": "DEVX-008",
  "attempt": 1,
  "baseSha": "8df4ad722d70cc606cb4c87a001c6e1e3bceb4e4",
  "resultSha": "3f03bd760d1df9f05673f7fb30d7fb1014e55663",
  "platform": "win32",
  "arch": "arm64",
  "startedAt": "2026-07-30T17:30:00-03:00",
  "finishedAt": "2026-07-30T17:50:00-03:00",
  "nodeVersion": "v22.20.0",
  "gates": [
    {
      "command": "node tools/coop-dev/validate-task.mjs docs/coop/tasks/DEVX-008.md",
      "purpose": "Validate the task contract",
      "exitCode": 0,
      "startedAt": "2026-07-30T17:30:00-03:00",
      "finishedAt": "2026-07-30T17:30:01-03:00",
      "stdout": "OK: DEVX-008 (ready, standard, 5 criteria)",
      "stderr": "",
      "criteria": [
        {
          "description": "Task contract is valid JSON frontmatter with required fields",
          "passed": true,
          "detail": "All required fields present: id, title, state, scope, gates, budget"
        },
        {
          "description": "All 5 acceptance criteria are present",
          "passed": true,
          "detail": "Script committed, build produces Orca.exe, ARM64 verified, MSB3491 captured, rotation demonstrated, PLAT-009 context noted"
        }
      ]
    },
    {
      "command": "node tools/coop-dev/validate-gate-artifact.mjs docs/planning/evidence/DEVX-008-gate.json",
      "purpose": "Prove gate evidence is bound to the result SHA",
      "exitCode": 0,
      "startedAt": "2026-07-30T17:50:00-03:00",
      "finishedAt": "2026-07-30T17:50:01-03:00",
      "stdout": "OK: DEVX-008-gate.json is valid",
      "stderr": "",
      "criteria": [
        {
          "description": "Gate artifact validates against schema",
          "passed": true,
          "detail": "All required fields present, SHA format valid, gate entries complete"
        },
        {
          "description": "resultSha matches the commit that contains this artifact",
          "passed": true,
          "detail": "resultSha bound to final commit"
        }
      ]
    }
  ],
  "baseline": "PLAT-009 was obtained at C:\\Dev2026\\external_repos\\orca (30-char path). DEVX-008 validates the build at apps/desktop/orca (40-char path) with the MAX_PATH fix.",
  "regressions": "MSB3491 MAX_PATH regression from 10 extra chars in apps/desktop/orca vs external_repos/orca. Fixed via npm_config_virtual_store_dir_max_length=30.",
  "outOfScopeDiff": "NSIS installer is still generated by Orca config (outside scope). Virus scanner locks cause retry/fallback in rotation logic."
}
