{
  "task": "DEVX-045",
  "attempt": 5,
  "baseSha": "0d4e64bd47df8967f0fe8822bc6607c07c5e9666",
  "resultSha": "770d0d2ef640237b9a4a37f8c79691736d31777f",
  "platform": "win32",
  "arch": "arm64",
  "nodeVersion": "v22.20.0",
  "startedAt": "2026-08-06T09:00:00.000-03:00",
  "finishedAt": "2026-08-06T14:15:09.000-03:00",
  "gates": [
    {
      "command": "node tools/coop-dev/validate-task.mjs docs/coop/tasks/DEVX-045.md",
      "purpose": "Validate the task contract",
      "exitCode": 0,
      "startedAt": "2026-08-06T14:13:40.000-03:00",
      "finishedAt": "2026-08-06T14:13:41.000-03:00",
      "stdout": "OK: DEVX-045 (ready, standard, 5 criteria)",
      "criteria": []
    },
    {
      "command": "node tools/coop-dev/validate-gate-artifact.mjs docs/planning/evidence/DEVX-045-gate.json --result-sha=770d0d2ef640237b9a4a37f8c79691736d31777f",
      "purpose": "Prove gate evidence is bound to the result SHA",
      "exitCode": 0,
      "startedAt": "2026-08-06T14:15:10.000-03:00",
      "finishedAt": "2026-08-06T14:15:11.000-03:00",
      "criteria": []
    },
    {
      "command": "../../../tools/pnpm-arm64.cmd exec vitest run --config config/vitest.config.ts src/main/updater",
      "purpose": "Run the FULL updater test surface (all 10 updater test files)",
      "exitCode": 0,
      "startedAt": "2026-08-06T14:14:29.000-03:00",
      "finishedAt": "2026-08-06T14:14:33.000-03:00",
      "stdout": "Test Files 8 passed | 2 skipped (10); Tests 93 passed | 12 skipped (105)",
      "criteria": [
        {
          "description": "getRemoteServerUpdateSupport() reports automatic: false and reason: 'updater-unavailable' on packaged builds.",
          "passed": true
        },
        {
          "description": "scheduleAutomaticUpdateCheck() and startup/resume listeners do not schedule automatic update check timers or phone home to stablyai/orca.",
          "passed": true
        },
        {
          "description": "checkForUpdatesFromMenu() returns not-available for manual release checks without phoning home.",
          "passed": true
        },
        {
          "description": "checkForUpdates() returns not-available for background release checks without phoning home.",
          "passed": true
        },
        {
          "description": "electron-builder.config.cjs does not contain publish pointing to stablyai/orca.",
          "passed": true
        }
      ]
    }
  ],
  "baseline": "Previously Orca packaged builds were configured to publish to stablyai/orca and performed automatic and manual update checks fetching release tags from stablyai/orca on GitHub.",
  "regressions": "None. All 105 tests across all 10 updater test files passed (93 passed, 12 skipped for darwin-only features). Retired unreachable release-feed failure-handling tests in updater.check-failure.test.ts.",
  "outOfScopeDiff": "None. All modified files are in scope.allow."
}
