{
  "task": "DEVX-006",
  "attempt": 1,
  "baseSha": "8df4ad722d70cc606cb4c87a001c6e1e3bceb4e4",
  "resultSha": "be7afc30240c51e30ddc88e632c51ec225e81098",
  "platform": "win32",
  "arch": "arm64",
  "nodeVersion": "v22.20.0",
  "startedAt": "2026-07-30T20:16:03.000Z",
  "finishedAt": "2026-07-30T20:17:37.000Z",
  "baseline": "Commit bccb83b080ca789e30312882315863d8fc6e7ce1, 144 failing tests (pre-existing, not regression)",
  "gates": [
    {
      "command": "node tools/coop-dev/validate-task.mjs docs/coop/tasks/DEVX-006.md",
      "purpose": "Validate the task contract",
      "exitCode": 0,
      "startedAt": "2026-07-30T20:16:36.000Z",
      "finishedAt": "2026-07-30T20:16:36.500Z",
      "stdout": "OK: DEVX-006 (ready, standard, 5 criteria)\n",
      "criteria": [
        {
          "description": "Task contract is valid",
          "passed": true
        }
      ]
    },
    {
      "command": "node tools/coop-dev/validate-gate-artifact.mjs docs/planning/evidence/DEVX-006-gate.json --result-sha=be7afc30240c51e30ddc88e632c51ec225e81098",
      "purpose": "Prove gate evidence is bound to the result SHA",
      "exitCode": 0,
      "startedAt": "2026-07-30T20:17:36.500Z",
      "finishedAt": "2026-07-30T20:17:37.000Z",
      "stdout": "VALID\n",
      "criteria": [
        {
          "description": "Gate artifact validates against schema and result SHA",
          "passed": true
        }
      ]
    },
    {
      "command": "tools/pnpm-arm64.cmd exec vitest run --config config/vitest.config.ts src/main/ai-vault/session-scanner-crush.test.ts",
      "purpose": "Run only this task's tests, from apps/desktop/orca",
      "exitCode": 0,
      "startedAt": "2026-07-30T20:16:36.500Z",
      "finishedAt": "2026-07-30T20:17:30.000Z",
      "stdout": "Test Files  1 passed (1)\nTests  10 passed (10)\n",
      "criteria": [
        {
          "description": "All 10 tests pass",
          "passed": true
        }
      ]
    }
  ]
}
